{
    "fact_table": "simple",
    "dimensions": {
        "foo": {
            "label": "Foo",
            "key_attribute": "key",
            "label_attribute": "key",
            "attributes": {
                "key": {"label": "Key", "column": "foo_key", "type": "string"}
            }
        },
        "bar": {
            "label": "Bar",
            "key_attribute": "key",
            "attributes": {
                "key": {"label": "Key", "column": "bar_key", "type": "string"}
            }
        },
        "baz": {
            "label": "Baz",
            "key_attribute": "key",
            "attributes": {
                "key": {"label": "Key", "column": "bar_key", "type": "string"}
            }
        },
        "waz": {
            "label": "Waz",
            "key_attribute": "key",
            "attributes": {
                "key": {"label": "Key", "column": "bar_key", "type": "string"}
            }
        }

    },
    "measures": {
        "amount": {
            "label": "Amount in USD",
            "column": "amount",
            "type": "integer"
        }
    },
    "hierarchies": {
        "bazwaz": {
            "label": "BazWaz",
            "levels": [
                "baz", "waz"
            ]
        }
    }
}
